{
  "benchmark_id": "sectorbench-healthcare-clinics",
  "benchmark_version": "0.1.0",
  "dataset_version": "0.1.0-example-unvalidated",
  "rubric_version": "0.1.0",
  "candidate_prompt_version": "candidate-prompt-0.1.0",
  "judge_prompt_version": "absolute-judge-0.1.0",
  "candidate_models": [
    {"provider": "example", "model_id": "candidate-model", "model_version": "pinned-snapshot", "endpoint_revision": null}
  ],
  "judge_models": [
    {"provider": "example-a", "model_id": "judge-model-a", "model_version": "pinned-snapshot", "endpoint_revision": null},
    {"provider": "example-b", "model_id": "judge-model-b", "model_version": "pinned-snapshot", "endpoint_revision": null}
  ],
  "run_parameters": {"temperature": 0, "top_p": 1, "seed": 42},
  "code_revision": "replace-with-git-commit-or-release-hash",
  "environment_fingerprint": {"python": "3.11+"},
  "created_at": "2026-01-01T00:00:00Z"
}
